{
  "schema_version": "1.0",
  "bundle_id": "eledia-default",
  "bundle_version": "2026.04.3",
  "generated_at": "2026-04-05T12:00:00Z",
  "language": "de",
  "questions": [
    {
      "id": "checkin-0001",
      "ziel": "checkin",
      "kategorie": [
        "stimmung",
        "energie"
      ],
      "frage": "Auf einer Skala von 1 bis 10: Wie viel Energie bringst du heute mit?",
      "hat_antwort": false,
      "sprache": "de",
      "lizenz": "CC-BY-4.0",
      "version": "1",
      "status": "published",
      "created_at": "2026-04-05T10:00:00Z",
      "updated_at": "2026-04-05T10:00:00Z",
      "autor": "eLeDia Redaktion",
      "zielgruppe": ["team", "fuehrungskraefte"],
      "kontext": ["arbeit"]
    },
    {
      "id": "checkin-0002",
      "ziel": "checkin",
      "kategorie": [
        "kennenlernen",
        "eisbrecher"
      ],
      "frage": "Welches Buch, welcher Film oder welche Serie hat dich zuletzt überrascht — und warum?",
      "hat_antwort": false,
      "sprache": "de",
      "lizenz": "CC-BY-4.0",
      "version": "1",
      "status": "published",
      "created_at": "2026-04-05T10:00:00Z",
      "updated_at": "2026-04-05T10:00:00Z",
      "autor": "eLeDia Redaktion"
    },
    {
      "id": "checkin-0003",
      "ziel": "checkin",
      "kategorie": [
        "arbeitsmodus",
        "fokus"
      ],
      "frage": "Was ist die eine Sache, die diesen Tag zu einem guten Tag macht, wenn du sie heute schaffst?",
      "hat_antwort": false,
      "sprache": "de",
      "lizenz": "CC-BY-4.0",
      "version": "1",
      "status": "published",
      "created_at": "2026-04-05T10:00:00Z",
      "updated_at": "2026-04-05T10:00:00Z",
      "autor": "eLeDia Redaktion"
    },
    {
      "id": "checkin-0004",
      "ziel": "checkin",
      "kategorie": [
        "stimmung"
      ],
      "frage": "Wenn dein heutiger Gemütszustand ein Wetterbericht wäre — wie sähe die Vorhersage aus?",
      "hat_antwort": false,
      "sprache": "de",
      "lizenz": "CC-BY-4.0",
      "version": "1",
      "status": "published",
      "created_at": "2026-04-05T10:00:00Z",
      "updated_at": "2026-04-05T10:00:00Z",
      "autor": "eLeDia Redaktion"
    },
    {
      "id": "checkin-0005",
      "ziel": "checkin",
      "kategorie": [
        "beziehung",
        "kennenlernen"
      ],
      "frage": "Mit wem im Team hattest du in den letzten Tagen den spannendsten Austausch, und worüber?",
      "hat_antwort": false,
      "sprache": "de",
      "lizenz": "CC-BY-4.0",
      "version": "1",
      "status": "published",
      "created_at": "2026-04-05T10:00:00Z",
      "updated_at": "2026-04-05T10:00:00Z",
      "autor": "eLeDia Redaktion"
    },
    {
      "id": "checkin-0006",
      "ziel": "checkin",
      "kategorie": [
        "persoenliche-entwicklung"
      ],
      "frage": "Was hast du in den letzten zwei Wochen ausprobiert, was du vorher noch nie gemacht hast?",
      "hat_antwort": false,
      "sprache": "de",
      "lizenz": "CC-BY-4.0",
      "version": "1",
      "status": "published",
      "created_at": "2026-04-05T10:00:00Z",
      "updated_at": "2026-04-05T10:00:00Z",
      "autor": "eLeDia Redaktion"
    },
    {
      "id": "checkin-0007",
      "ziel": "checkin",
      "kategorie": [
        "eisbrecher"
      ],
      "frage": "Wenn du heute einen Superheldennamen tragen müsstest, basierend auf deiner Stimmung: Wie würdest du heißen?",
      "hat_antwort": false,
      "sprache": "de",
      "lizenz": "CC-BY-4.0",
      "version": "1",
      "status": "published",
      "created_at": "2026-04-05T10:00:00Z",
      "updated_at": "2026-04-05T10:00:00Z",
      "autor": "eLeDia Redaktion"
    },
    {
      "id": "checkin-0008",
      "ziel": "checkin",
      "kategorie": [
        "fokus",
        "arbeitsmodus"
      ],
      "frage": "Was lenkt dich gerade am meisten ab, und wie kannst du es bis zum Ende des Meetings parken?",
      "hat_antwort": false,
      "sprache": "de",
      "lizenz": "CC-BY-4.0",
      "version": "1",
      "status": "published",
      "created_at": "2026-04-05T10:00:00Z",
      "updated_at": "2026-04-05T10:00:00Z",
      "autor": "eLeDia Redaktion"
    },
    {
      "id": "checkin-0009",
      "ziel": "checkin",
      "kategorie": [
        "energie",
        "stimmung"
      ],
      "frage": "Wenn du deine heutige Energie als Farbe darstellen müsstest — welche wäre es und warum?",
      "hat_antwort": false,
      "sprache": "de",
      "lizenz": "CC-BY-4.0",
      "version": "1",
      "status": "published",
      "created_at": "2026-04-05T10:00:00Z",
      "updated_at": "2026-04-05T10:00:00Z",
      "autor": "eLeDia Redaktion"
    },
    {
      "id": "checkout-0001",
      "ziel": "checkout",
      "kategorie": [
        "ausblick",
        "aktion"
      ],
      "frage": "Was ist der eine konkrete Schritt, den du bis zum nächsten Treffen umsetzen willst?",
      "hat_antwort": false,
      "sprache": "de",
      "lizenz": "CC-BY-4.0",
      "version": "1",
      "status": "published",
      "created_at": "2026-04-05T10:00:00Z",
      "updated_at": "2026-04-05T10:00:00Z",
      "autor": "eLeDia Redaktion"
    },
    {
      "id": "checkout-0002",
      "ziel": "checkout",
      "kategorie": [
        "feedback",
        "verbesserung"
      ],
      "frage": "Was würdest du beim nächsten Mal anders machen, damit wir gemeinsam produktiver sind?",
      "hat_antwort": false,
      "sprache": "de",
      "lizenz": "CC-BY-4.0",
      "version": "1",
      "status": "published",
      "created_at": "2026-04-05T10:00:00Z",
      "updated_at": "2026-04-05T10:00:00Z",
      "autor": "eLeDia Redaktion"
    },
    {
      "id": "checkout-0003",
      "ziel": "checkout",
      "kategorie": [
        "wertschaetzung",
        "beziehung"
      ],
      "frage": "Wem im Team möchtest du heute ein ehrliches Dankeschön für etwas Konkretes aussprechen?",
      "hat_antwort": false,
      "sprache": "de",
      "lizenz": "CC-BY-4.0",
      "version": "1",
      "status": "published",
      "created_at": "2026-04-05T10:00:00Z",
      "updated_at": "2026-04-05T10:00:00Z",
      "autor": "eLeDia Redaktion"
    },
    {
      "id": "checkout-0004",
      "ziel": "checkout",
      "kategorie": [
        "stimmung",
        "energie"
      ],
      "frage": "Wie fühlst du dich jetzt im Vergleich zum Beginn des Meetings?",
      "hat_antwort": false,
      "sprache": "de",
      "lizenz": "CC-BY-4.0",
      "version": "1",
      "status": "published",
      "created_at": "2026-04-05T10:00:00Z",
      "updated_at": "2026-04-05T10:00:00Z",
      "autor": "eLeDia Redaktion"
    },
    {
      "id": "checkout-0005",
      "ziel": "checkout",
      "kategorie": [
        "ausblick"
      ],
      "frage": "Was nimmst du aus diesem Termin mit, das du noch heute Abend jemandem erzählen möchtest?",
      "hat_antwort": false,
      "sprache": "de",
      "lizenz": "CC-BY-4.0",
      "version": "1",
      "status": "published",
      "created_at": "2026-04-05T10:00:00Z",
      "updated_at": "2026-04-05T10:00:00Z",
      "autor": "eLeDia Redaktion"
    },
    {
      "id": "checkout-0006",
      "ziel": "checkout",
      "kategorie": [
        "aktion",
        "verbesserung"
      ],
      "frage": "Welche eine Entscheidung ist hier gefallen, und wer ist dafür verantwortlich, sie nachzuverfolgen?",
      "hat_antwort": false,
      "sprache": "de",
      "lizenz": "CC-BY-4.0",
      "version": "1",
      "status": "published",
      "created_at": "2026-04-05T10:00:00Z",
      "updated_at": "2026-04-05T10:00:00Z",
      "autor": "eLeDia Redaktion"
    },
    {
      "id": "checkout-0007",
      "ziel": "checkout",
      "kategorie": [
        "feedback"
      ],
      "frage": "Was war heute besonders wertvoll für dich — und was hätte ruhig weggelassen werden können?",
      "hat_antwort": false,
      "sprache": "de",
      "lizenz": "CC-BY-4.0",
      "version": "1",
      "status": "published",
      "created_at": "2026-04-05T10:00:00Z",
      "updated_at": "2026-04-05T10:00:00Z",
      "autor": "eLeDia Redaktion"
    },
    {
      "id": "checkout-0008",
      "ziel": "checkout",
      "kategorie": [
        "wertschaetzung"
      ],
      "frage": "Welcher Beitrag aus der Runde hat dich am meisten zum Nachdenken gebracht?",
      "hat_antwort": false,
      "sprache": "de",
      "lizenz": "CC-BY-4.0",
      "version": "1",
      "status": "published",
      "created_at": "2026-04-05T10:00:00Z",
      "updated_at": "2026-04-05T10:00:00Z",
      "autor": "eLeDia Redaktion"
    },
    {
      "id": "retro-0001",
      "ziel": "retro",
      "kategorie": [
        "was-lief-gut",
        "zusammenarbeit"
      ],
      "frage": "Welcher Moment dieser Woche hat dich besonders stolz auf das Team gemacht?",
      "hat_antwort": false,
      "sprache": "de",
      "lizenz": "CC-BY-4.0",
      "version": "1",
      "status": "published",
      "created_at": "2026-04-05T10:00:00Z",
      "updated_at": "2026-04-05T10:00:00Z",
      "autor": "eLeDia Redaktion"
    },
    {
      "id": "retro-0002",
      "ziel": "retro",
      "kategorie": [
        "was-lief-schlecht",
        "prozess"
      ],
      "frage": "Welcher Prozessschritt hat in dieser Iteration am meisten Reibung verursacht?",
      "hat_antwort": false,
      "sprache": "de",
      "lizenz": "CC-BY-4.0",
      "version": "1",
      "status": "published",
      "created_at": "2026-04-05T10:00:00Z",
      "updated_at": "2026-04-05T10:00:00Z",
      "autor": "eLeDia Redaktion"
    },
    {
      "id": "retro-0003",
      "ziel": "retro",
      "kategorie": [
        "lernen"
      ],
      "frage": "Was hast du in den letzten zwei Wochen gelernt, das du vorher nicht wusstest — fachlich oder persönlich?",
      "hat_antwort": false,
      "sprache": "de",
      "lizenz": "CC-BY-4.0",
      "version": "1",
      "status": "published",
      "created_at": "2026-04-05T10:00:00Z",
      "updated_at": "2026-04-05T10:00:00Z",